{
  "$schema": "./component-surface-semantic-registry.schema.json",
  "schemaVersion": "fsusui.component-surface-semantic-registry.v1",
  "registryVersion": "1.1.0",
  "owner": {
    "id": "fsusui.design-governance",
    "kind": "specification"
  },
  "reviewPolicy": {
    "mode": "source-digest-required",
    "ownerReviewRequired": true,
    "reviewAfter": "2026-11-05"
  },
  "allowlist": [],
  "generated": {
    "producer": "scripts/check-component-surface-semantic-registry.mjs",
    "sourceRevision": "7e72bfcdd6a16e35af684503e7d72b73fa154082",
    "digestAlgorithm": "sha256"
  },
  "sourceDigests": {
    "design-contract": {
      "path": "docs/design.md",
      "kind": "authority",
      "algorithm": "sha256",
      "digest": "24c88676101dde43bb0907ed173f001b6e1659973caf19701ea57eddf0617039"
    },
    "token-contract": {
      "path": "spec/tokens/tokens.json",
      "kind": "authority",
      "algorithm": "sha256",
      "digest": "c97d4b2f3ffcf311fb060b21e12e13367763fb4ca9ba9c8fa4cacf6f72d381d1"
    },
    "component-contracts": {
      "path": "spec/components/contracts/v1/vue-public-contracts.json",
      "kind": "authority",
      "algorithm": "sha256",
      "digest": "0cd6d1b939a5d134dc38ceec82f373e040180a4095b741d63655942c5ee92124"
    },
    "component-motion": {
      "path": "docs/components/motion.md",
      "kind": "authority",
      "algorithm": "sha256",
      "digest": "a0f207697bd1065303d0a35f5cc8b4c92ed4a35371a13e2186721cb597e5d87f"
    },
    "component-public-shell": {
      "path": "docs/components/public-shell.md",
      "kind": "authority",
      "algorithm": "sha256",
      "digest": "6a20a7ed2d99bbb5608c60e6f7540ea0b88f1045c250906b89df3a0865ce41fe"
    },
    "implementation-01": {
      "path": "vue/packages/theme-chalk/src/select-dropdown.scss",
      "kind": "implementation",
      "algorithm": "sha256",
      "digest": "d4cbee04be5d7c411cec28967ca2c022026731325220390dc3deaa7a556dc55d"
    },
    "implementation-02": {
      "path": "vue/packages/theme-chalk/src/tree.scss",
      "kind": "implementation",
      "algorithm": "sha256",
      "digest": "98caf37066d93eaeb1d8400c3c03186beac059df56460070f4fd66d16d9c0fb0"
    },
    "implementation-03": {
      "path": "vue/packages/theme-chalk/src/date-picker/picker-panel.scss",
      "kind": "implementation",
      "algorithm": "sha256",
      "digest": "c7f9f9339c1008b136951cf9c0f0a881c9cc1b530bb653263ccb6269522367bd"
    },
    "implementation-04": {
      "path": "vue/packages/theme-chalk/src/date-picker/date-table.scss",
      "kind": "implementation",
      "algorithm": "sha256",
      "digest": "2f6568e5ae8ee58698ea709533ba07e9ca1703eebdb2a12ca239e13f00bf7cf6"
    },
    "implementation-05": {
      "path": "vue/packages/theme-chalk/src/date-picker/time-spinner.scss",
      "kind": "implementation",
      "algorithm": "sha256",
      "digest": "f6823cf21f51ae029ded14440abc2a4c809ddcc2dc2ca4d04337ec6a3f2eddaf"
    },
    "implementation-06": {
      "path": "vue/packages/theme-chalk/src/upload.scss",
      "kind": "implementation",
      "algorithm": "sha256",
      "digest": "0df5695515c54e9f83357d83860f30f029d7725bc94e47b94de1c82587e138c5"
    },
    "implementation-07": {
      "path": "vue/packages/theme-chalk/src/metric-primitives.scss",
      "kind": "implementation",
      "algorithm": "sha256",
      "digest": "229c5a690a871ccefe86d5b4598fc95978d20fad6ed3927af8e4f6b4954ffe36"
    },
    "implementation-08": {
      "path": "vue/packages/theme-chalk/src/tabs.scss",
      "kind": "implementation",
      "algorithm": "sha256",
      "digest": "304da45579dd5b5ac350804f7fd85ed4854d36f3a8164e6cff7cf8b60dfd06a8"
    },
    "implementation-09": {
      "path": "vue/packages/theme-chalk/src/menu.scss",
      "kind": "implementation",
      "algorithm": "sha256",
      "digest": "888253eb20a985b13ebe0e10039f7c0f79251105c45a03da2d5d811e9e946de7"
    },
    "implementation-10": {
      "path": "vue/packages/theme-chalk/src/radio-button.scss",
      "kind": "implementation",
      "algorithm": "sha256",
      "digest": "9c8c4b0c9d5f586246158c77184055e7813274d17511109a433a005e5dc806b5"
    },
    "implementation-11": {
      "path": "vue/packages/theme-chalk/src/checkbox-button.scss",
      "kind": "implementation",
      "algorithm": "sha256",
      "digest": "54c5e4b5fb018be692d9b81c76d52662d209e7354e1d25c21feaf36cc33b0467"
    },
    "implementation-12": {
      "path": "vue/packages/theme-chalk/src/fsus-theme.scss",
      "kind": "implementation",
      "algorithm": "sha256",
      "digest": "01fe6fa8c53f49c97261471714db8ca4532a3d592edc72c07b23fe755e9dcbc3"
    },
    "implementation-13": {
      "path": "vue/packages/theme-chalk/src/collection-primitives.scss",
      "kind": "implementation",
      "algorithm": "sha256",
      "digest": "5c2f857779e5cc83331bcb254209c9dcfae6971e03a0f7b566571251c3dc070c"
    },
    "implementation-14": {
      "path": "vue/packages/theme-chalk/src/input-number.scss",
      "kind": "implementation",
      "algorithm": "sha256",
      "digest": "669dd2d102f7ece9d70be491d8713d930ad40ca672656c0ad056a75292aba221"
    },
    "implementation-15": {
      "path": "vue/packages/theme-chalk/src/dialog.scss",
      "kind": "implementation",
      "algorithm": "sha256",
      "digest": "212ecdb7f1d79314338ad9566b037cca7fba4299945cd8e150d22f006a94b8c1"
    },
    "implementation-16": {
      "path": "vue/packages/theme-chalk/src/inbox-primitives.scss",
      "kind": "implementation",
      "algorithm": "sha256",
      "digest": "daf45f5f074e4e0a1e1be0404f58a295cdc83c1237a5f0031492d91a6cacf914"
    },
    "implementation-17": {
      "path": "vue/packages/theme-chalk/src/settings-primitives.scss",
      "kind": "implementation",
      "algorithm": "sha256",
      "digest": "6b80611b3f9cb697af44bfa26fdead221b3109361a999a5b4fd8a3cef81c61ec"
    },
    "implementation-18": {
      "path": "vue/packages/theme-chalk/src/loading.scss",
      "kind": "implementation",
      "algorithm": "sha256",
      "digest": "4571b9e10ba703cf2b54d34151755cbea90fc951a06508276b8a04255144c52d"
    },
    "implementation-19": {
      "path": "vue/packages/theme-chalk/src/table.scss",
      "kind": "implementation",
      "algorithm": "sha256",
      "digest": "51dd8ea5f1a778caef995362d24e99a883dace611774a5dbf70bd2ea294f3467"
    },
    "implementation-20": {
      "path": "vue/packages/theme-chalk/src/common/transition.scss",
      "kind": "implementation",
      "algorithm": "sha256",
      "digest": "a5a640588fca159c8141d9185f8b71a4eeff438fe5a92e2af646e2b864d1a2d7"
    },
    "implementation-21": {
      "path": "vue/packages/theme-chalk/src/public-shell.scss",
      "kind": "implementation",
      "algorithm": "sha256",
      "digest": "cb20f5dc52c7b1d7297eab1809a62bec063516aec2365ebbf9cdc1ab97b4c33f"
    },
    "implementation-22": {
      "path": "vue/packages/theme-chalk/src/drawer.scss",
      "kind": "implementation",
      "algorithm": "sha256",
      "digest": "2b273dd1be59a098370a33cd2a5853d7867dff1edd5fd2331c1120d138e92fad"
    },
    "implementation-23": {
      "path": "vue/packages/theme-chalk/src/notification.scss",
      "kind": "implementation",
      "algorithm": "sha256",
      "digest": "6db558f46d42f3f1347907c309bb62835dee6727dde7986da97cb60361b097c1"
    }
  },
  "rules": [
    {
      "id": "web.select.option-row",
      "componentId": "web.select",
      "partId": "option-row",
      "surfaceRole": "overlay.option-row",
      "issues": [
        293
      ],
      "owner": {
        "id": "fsusui.web.vue",
        "kind": "implementation"
      },
      "selectorOwnership": {
        "owner": {
          "id": "fsusui.web.vue",
          "kind": "implementation"
        },
        "selectors": [
          {
            "platform": "web",
            "selector": ".el-select-dropdown__item",
            "source": {
              "sourceId": "implementation-01",
              "path": "vue/packages/theme-chalk/src/select-dropdown.scss",
              "pointer": "selector:.el-select-dropdown__item"
            }
          }
        ]
      },
      "sourceOwnership": {
        "owner": {
          "id": "fsusui.web.vue",
          "kind": "implementation"
        },
        "sources": [
          {
            "sourceId": "implementation-01",
            "path": "vue/packages/theme-chalk/src/select-dropdown.scss",
            "pointer": "selector:.el-select-dropdown__item"
          }
        ]
      },
      "canonicalSources": [
        {
          "sourceId": "design-contract",
          "path": "docs/design.md",
          "pointer": "#surface-taxonomy"
        },
        {
          "sourceId": "token-contract",
          "path": "spec/tokens/tokens.json",
          "pointer": "/tokens/density.select.option.y"
        },
        {
          "sourceId": "component-contracts",
          "path": "spec/components/contracts/v1/vue-public-contracts.json",
          "pointer": "/components/component.el-select"
        }
      ],
      "constraints": {
        "geometry": [
          {
            "sourceId": "token-contract",
            "path": "spec/tokens/tokens.json",
            "pointer": "/tokens/density.select.option.y"
          }
        ],
        "typography": [],
        "stateColor": [],
        "disabled": [],
        "motion": [],
        "surfaceCardMotif": []
      },
      "scope": {
        "themes": [
          "light",
          "dark"
        ],
        "densities": [
          "default",
          "compact",
          "touch"
        ],
        "devices": [
          "desktop",
          "mobile",
          "touch"
        ]
      },
      "variants": [],
      "exceptions": [],
      "verificationPolicy": {
        "staticFields": [
          "geometry",
          "typography",
          "stateColor",
          "disabled",
          "motion"
        ],
        "visualProbeFields": [
          "surfaceCardMotif"
        ],
        "visualRequirements": [
          {